{
  "$schema": "https://json-schema.org/draft/2020-12/schema",
  "$id": "https://ligature-workspace/schemas/project-descriptor.schema.json",
  "title": "Reliance-graph pipeline project structure descriptor",
  "description": "Stage P0 input contract (plan.md \u00a71.1). One per project workspace. Every later stage reads this instead of hardcoding project shape.",
  "type": "object",
  "required": [
    "schema_version",
    "project",
    "mode",
    "crates",
    "verifier_policy",
    "compatibility_policy",
    "write_set",
    "gate_integrity",
    "review"
  ],
  "additionalProperties": false,
  "if": {
    "properties": {
      "mode": {
        "const": "port"
      }
    }
  },
  "then": {
    "required": [
      "port_source"
    ]
  },
  "else": {
    "not": {
      "required": [
        "port_source"
      ]
    }
  },
  "properties": {
    "schema_version": {
      "type": "string",
      "const": "1.0"
    },
    "project": {
      "type": "object",
      "required": [
        "name",
        "crate_naming_convention"
      ],
      "additionalProperties": false,
      "properties": {
        "name": {
          "type": "string",
          "pattern": "^[a-z][a-z0-9-]*$",
          "description": "Project identifier, used as a namespace prefix in generated artifact paths."
        },
        "crate_naming_convention": {
          "type": "string",
          "description": "This project's own crate/package naming rule, prose or regex (e.g. '^myproj-[a-z]+'). Never hardcoded by the pipeline itself -- see docs/concept-to-code-modifications.md gap #4."
        }
      }
    },
    "mode": {
      "type": "string",
      "enum": [
        "greenfield",
        "port"
      ],
      "description": "greenfield = Mode R, requirements-governed decomposition (plan.md \u00a711). port = Mode P, a foreign-language source port validated by differential testing against an oracle."
    },
    "port_source": {
      "type": "object",
      "description": "Required when mode == 'port'; absent when mode == 'greenfield'.",
      "required": [
        "repository",
        "language",
        "oracle_build_command"
      ],
      "additionalProperties": false,
      "properties": {
        "repository": {
          "type": "string",
          "description": "Path or URL to the source-of-truth repository being ported (e.g. the C++ project)."
        },
        "language": {
          "type": "string",
          "description": "Origin language, e.g. 'cpp'. Recorded here, not in concept-to-code's schema -- see docs/concept-to-code-modifications.md gap #3."
        },
        "oracle_build_command": {
          "type": "string",
          "description": "Command that builds/runs the origin-language oracle used for Mode P differential testing (plan.md \u00a711)."
        }
      }
    },
    "crates": {
      "type": "array",
      "minItems": 1,
      "description": "concept-to-code binding per crate -- replaces ad hoc --crate-dir/--contracts-crate/--specs-search-root flags (docs/concept-to-code-modifications.md gap #1).",
      "items": {
        "type": "object",
        "required": [
          "crate_dir",
          "contracts_crate",
          "specs_search_root"
        ],
        "additionalProperties": false,
        "properties": {
          "crate_dir": {
            "type": "string",
            "description": "Path (workspace-relative) to the crate root containing src/ and tests/."
          },
          "contracts_crate": {
            "type": "string",
            "default": "contracts",
            "description": "Name of the verifier-contracts facade crate this crate's generated stubs depend on."
          },
          "specs_search_root": {
            "type": "string",
            "description": "Root directory searched for another crate's spec JSON when resolving implements/trait_ref/variants."
          }
        }
      }
    },
    "verifier_policy": {
      "type": "object",
      "description": "Default verifier per cluster (plan.md \u00a74). The key set is documented (chainlink #76): 'default' (required) is the verifier for every cluster not listed by name; any other key names a cluster and holds that cluster's verifier, so a cluster not listed as its own key uses 'default'; 'supporting' is the declared shape for a second or supporting verifier whose evidence backs the primary one (e.g. a deductive cluster with a model-checking fallback) -- arbitrary extra keys are per-cluster overrides, NOT a composition, and a key that matches no cluster is simply never read. Every value must be a member of the verifier enum.",
      "required": [
        "default"
      ],
      "properties": {
        "default": {
          "$ref": "#/$defs/verifier"
        },
        "supporting": {
          "type": "array",
          "items": {
            "$ref": "#/$defs/verifier"
          },
          "description": "Additional verifiers whose evidence supports the primary one (chainlink #76) -- the real shape for multi-verifier composition, replacing the accident of an arbitrary extra key holding a second enum member (which validated while nothing ever read it). Order is not significant; duplicates are permitted but meaningless."
        }
      },
      "additionalProperties": {
        "$ref": "#/$defs/verifier"
      }
    },
    "closure_kind": {
      "type": "string",
      "enum": [
        "deductive",
        "bounded",
        "partial"
      ],
      "description": "The project's intended closure_kind for its clusters, declared before any code exists (chainlink #73). plan.md §4's vocabulary: deductive = Creusot/Verus-owned (universal over inputs, modulo SMT completeness and trusted specs); bounded = Kani-owned (holds only within unwind/harness bounds and enumerated monomorphizations); partial = partially verified (chainlink #85) -- a pilot that knows it cannot achieve full deductive closure may declare that intent here instead of being limited to the two uniform claims its clusters can only round to. This records intent only -- each cluster's closure profile (specs/_closure/<cluster>.json) remains the authoritative per-cluster declaration at Stage 8C, and gate g14 recomputes closure_kind from the evidence actually present, rejecting a uniform kind the evidence refutes (a `deductive` claim over a closure containing a Kani result is a G17 hard error). Optional and deliberately absent from the init template: a project that has not chosen an intent yet must not be silently defaulted to 'deductive'."
    },
    "verifier_backends": {
      "type": "object",
      "description": "plan.md \u00a78.3 / chainlink #47 -- pluggable verifier dispatch, one command per verifier system, exactly as llm_backend is a pluggable one-shot command for Stage 0/3. `pipeline.py check-bridges` compiles a promoted bridge's bridge_logic to a harness and invokes the command for the verifier that owns the bridge's cluster, appending the generated harness path. The command must print one JSON verdict object on stdout: {result: pass|fail, scope, assumptions, config}. Optional and deliberately absent by default: with no backend configured, no bridge check is recorded and the gate blocks -- a verifier that never ran must never produce a pass, so the ceiling stays harness-tested (never bridge-checked).",
      "additionalProperties": false,
      "properties": {
        "creusot": {
          "type": "object",
          "required": [
            "command"
          ],
          "additionalProperties": false,
          "properties": {
            "command": {
              "type": "string",
              "minLength": 1,
              "description": "Invocation, split on whitespace; the harness path is appended as the final argument."
            }
          }
        },
        "kani": {
          "type": "object",
          "required": [
            "command"
          ],
          "additionalProperties": false,
          "properties": {
            "command": {
              "type": "string",
              "minLength": 1,
              "description": "Invocation, split on whitespace; the harness path is appended as the final argument."
            }
          }
        },
        "verus": {
          "type": "object",
          "required": [
            "command"
          ],
          "additionalProperties": false,
          "properties": {
            "command": {
              "type": "string",
              "minLength": 1,
              "description": "Invocation, split on whitespace; the harness path is appended as the final argument."
            }
          }
        }
      }
    },
    "witness_backend": {
      "type": "object",
      "description": "plan.md §16.2 / chainlink #30 -- pluggable witness producer dispatch, one command, exactly as verifier_backends is pluggable dispatch for #47. `pipeline.py gate-g19` invokes this command fresh for every genuinely valid witness spec, appending --witness-id, --concept, --query, --fixture-id, --seed and --renderer taken from that spec's OWN current fields -- so a regenerated result's identity cannot silently disagree with what the spec currently declares, it was constructed from those exact values. The command must print one JSON canonical result object on stdout, matching docs/witness-result-schema.json (the same contract tests/fixtures/witnesses/stand_in_producer.py already implements). Optional and deliberately absent by default: with no backend configured, G19 cannot verify a determinism claim against an actual run and blocks -- a query that was never re-evaluated must never produce a pass.",
      "additionalProperties": false,
      "required": [
        "command"
      ],
      "properties": {
        "command": {
          "type": "string",
          "minLength": 1,
          "description": "Invocation, split on whitespace; --witness-id/--concept/--query/--fixture-id/--seed/--renderer are appended."
        }
      }
    },
    "compatibility_policy": {
      "type": "object",
      "required": [
        "reliance_policy_path"
      ],
      "additionalProperties": false,
      "properties": {
        "reliance_policy_path": {
          "type": "string",
          "default": "docs/reliance-policy.md",
          "description": "plan.md \u00a72 semantic policy doc, versioned governance -- not a one-time artifact."
        },
        "witness_policy_path": {
          "type": "string",
          "description": "plan.md \u00a716.5 -- optional, only if the project declares feature witnesses."
        }
      }
    },
    "write_set": {
      "type": "object",
      "required": [
        "allowed_roots",
        "protected_roots"
      ],
      "additionalProperties": false,
      "description": "The enforcement boundary for where the implementing agent may write (chainlink #77). Enforced read-only by `ligature write-set-check`: a file outside every allowed_roots pattern and not accounted for by protected_roots, the ownership manifest, a declared crate's specs/ tree, a canonical pipeline location, or the pinned upstream checkout is an out-of-set write, reported as a high-severity write-set finding in check --json and as status --json's write_set.state. A pattern matching every path (e.g. \"**\") or an empty protected_roots declares no boundary and is itself reported as a violation.",
      "properties": {
        "allowed_roots": {
          "type": "array",
          "items": {
            "type": "string"
          },
          "description": "Default allowed_write_set roots (plan.md \u00a710) -- a starting point each work package narrows, never widens."
        },
        "protected_roots": {
          "type": "array",
          "items": {
            "type": "string"
          },
          "description": "Default protected_write_set roots (plan.md \u00a710) -- specs, CI manifests, gate scripts, schemas, policy docs, Cargo/build files, harnesses, toolchain pins."
        }
      }
    },
    "gate_integrity": {
      "type": "array",
      "description": "Gate-implementation paths to hash-pin (G13 validates before any gate runs, plan.md \u00a710/\u00a712).",
      "items": {
        "type": "object",
        "required": [
          "path"
        ],
        "additionalProperties": false,
        "properties": {
          "path": {
            "type": "string"
          }
        }
      }
    },
    "llm_backend": {
      "type": "object",
      "description": "plan.md \u00a76.1 -- pluggable one-shot LLM backend for Stage 0/3 and findings-driven re-entry.",
      "required": [
        "kind"
      ],
      "additionalProperties": false,
      "properties": {
        "kind": {
          "type": "string",
          "enum": [
            "claude",
            "codex",
            "opencode",
            "manual"
          ],
          "description": "manual = print the constructed prompt and wait for the user to run it themselves and hand back the result."
        },
        "command": {
          "type": "string",
          "description": "Override the default invocation (e.g. a non-default claude -p flag set). Ignored when kind == 'manual'."
        }
      }
    },
    "review": {
      "$ref": "#/$defs/review"
    }
  },
  "$defs": {
    "verifier": {
      "type": "string",
      "enum": [
        "kani",
        "creusot",
        "verus"
      ],
      "description": "The verifier systems this pipeline dispatches to: 'creusot' (deductive verification for Rust), 'verus' (deductive verification for Rust), 'kani' (model checking for Rust). Case-sensitive, exact match -- no composition ('verus+kani' is not a value; declare a second verifier under verifier_policy.supporting), no whitespace tolerance."
    },
    "review": {
      "type": "object",
      "required": [
        "reviewer",
        "reviewed_at"
      ],
      "additionalProperties": false,
      "properties": {
        "reviewer": {
          "type": "string",
          "minLength": 1
        },
        "reviewed_at": {
          "type": "string",
          "format": "date",
          "pattern": "^[0-9]{4}-[0-9]{2}-[0-9]{2}$"
        }
      }
    }
  }
}
